{
  "contractVersion": 1,
  "appVersion": "1.1.7.1",
  "target": {
    "platform": "macos",
    "runtime": "electron",
    "arch": "arm64"
  },
  "os": {
    "productVersion": "unknown",
    "kernelVersion": "unknown",
    "arch": "arm64"
  },
  "process": {
    "arch": "arm64",
    "translationMode": "native"
  },
  "nativeHost": {
    "state": "not-applicable",
    "arch": "unknown",
    "protocolVersion": null
  }
}
